{
  "$schema": "https://json-schema.org/draft/2020-12/schema",
  "title": "display.system",
  "description": "A hand-drawn map of a running system (system-map/v1): typed blocks listed in the order a request meets them, links at any grain, the main path, stories and sticky notes. The renderer owns every position.",
  "type": "object",
  "required": ["id", "type", "title", "blocks"],
  "additionalProperties": false,
  "properties": {
    "id": { "type": "string", "minLength": 1 },
    "type": { "const": "display.system" },
    "title": { "type": "string", "minLength": 1, "maxLength": 100, "description": "The one claim the map makes. Drawn bold across the top." },
    "groups": { "type": "array", "maxItems": 6, "items": { "$ref": "#/$defs/group" } },
    "blocks": { "type": "array", "minItems": 2, "maxItems": 10, "items": { "$ref": "#/$defs/block" } },
    "links": { "type": "array", "maxItems": 40, "items": { "$ref": "#/$defs/link" } },
    "path": { "$ref": "#/$defs/path" },
    "stories": { "type": "array", "maxItems": 7, "items": { "$ref": "#/$defs/story" } },
    "notes": { "type": "array", "maxItems": 3, "items": { "$ref": "#/$defs/note" } },
    "lanes": {
      "type": "object",
      "additionalProperties": false,
      "properties": {
        "main": { "type": "string", "minLength": 1, "maxLength": 24 },
        "background": { "type": "string", "minLength": 1, "maxLength": 24 },
        "control": { "type": "string", "minLength": 1, "maxLength": 24 }
      }
    },
    "start": {
      "type": "object",
      "additionalProperties": false,
      "minProperties": 1,
      "maxProperties": 1,
      "properties": {
        "story": { "$ref": "#/$defs/id" },
        "block": { "$ref": "#/$defs/id" }
      }
    }
  },
  "$defs": {
    "id": { "type": "string", "pattern": "^[a-z][a-z0-9-]{0,39}$" },
    "status": { "enum": ["live", "planned", "retired"] },
    "medium": { "enum": ["memory", "disk", "bucket", "keys", "pages"] },
    "group": {
      "type": "object",
      "required": ["id", "label"],
      "additionalProperties": false,
      "properties": {
        "id": { "$ref": "#/$defs/id" },
        "label": { "type": "string", "minLength": 1, "maxLength": 40 },
        "kind": { "enum": ["zone", "machine", "process"] },
        "in": { "$ref": "#/$defs/id" }
      }
    },
    "block": {
      "type": "object",
      "required": ["id", "kind", "name", "role"],
      "additionalProperties": false,
      "properties": {
        "id": { "$ref": "#/$defs/id" },
        "kind": { "enum": ["actor", "app", "service", "worker", "store", "log", "external", "artifact", "doc"] },
        "name": { "type": "string", "minLength": 1, "maxLength": 28 },
        "role": { "type": "string", "minLength": 1, "maxLength": 48 },
        "group": { "$ref": "#/$defs/id" },
        "medium": { "$ref": "#/$defs/medium" },
        "tag": { "type": "string", "minLength": 1, "maxLength": 8 },
        "parts": { "type": "array", "maxItems": 8, "items": { "$ref": "#/$defs/part" } },
        "contents": {
          "type": "array",
          "maxItems": 6,
          "items": {
            "type": "object",
            "required": ["text"],
            "additionalProperties": false,
            "properties": {
              "text": { "type": "string", "minLength": 1, "maxLength": 40 },
              "note": { "type": "string", "minLength": 1, "maxLength": 60 },
              "sealed": { "type": "boolean" }
            }
          }
        },
        "about": { "type": "string", "minLength": 1, "maxLength": 280 },
        "critical": { "type": "boolean" },
        "status": { "$ref": "#/$defs/status" },
        "badges": { "type": "array", "maxItems": 2, "items": { "$ref": "#/$defs/badge" } },
        "lane": { "enum": ["main", "background", "control"] }
      }
    },
    "part": {
      "type": "object",
      "required": ["id", "shape", "name", "role"],
      "additionalProperties": false,
      "properties": {
        "id": { "$ref": "#/$defs/id" },
        "shape": {
          "enum": ["api", "relay", "gate", "router", "guard", "queue", "pool", "log", "recovery", "handoff", "watcher", "keys", "budget", "timer", "uploader", "codec", "compactor", "sweeper", "cache", "ui", "tool", "docs", "sdk", "module", "store"]
        },
        "name": { "type": "string", "minLength": 1, "maxLength": 28 },
        "role": { "type": "string", "minLength": 1, "maxLength": 48 },
        "medium": { "$ref": "#/$defs/medium" },
        "tag": { "type": "string", "minLength": 1, "maxLength": 8 },
        "about": { "type": "string", "minLength": 1, "maxLength": 280 },
        "status": { "$ref": "#/$defs/status" },
        "badges": { "type": "array", "maxItems": 2, "items": { "$ref": "#/$defs/badge" } }
      }
    },
    "link": {
      "type": "object",
      "required": ["from", "to"],
      "additionalProperties": false,
      "properties": {
        "from": { "$ref": "#/$defs/id" },
        "to": { "$ref": "#/$defs/id" },
        "label": { "type": "string", "minLength": 1, "maxLength": 28 },
        "style": { "enum": ["sync", "async", "copy", "control"] },
        "hidden": { "type": "boolean" }
      }
    },
    "step": {
      "type": "object",
      "required": ["from", "to", "say"],
      "additionalProperties": false,
      "properties": {
        "from": { "$ref": "#/$defs/id" },
        "to": { "$ref": "#/$defs/id" },
        "say": { "type": "string", "minLength": 1, "maxLength": 40 },
        "waitsFor": { "type": "integer", "minimum": 1, "maximum": 5 },
        "mark": { "enum": ["risk", "stop"] }
      }
    },
    "path": {
      "type": "object",
      "required": ["title", "steps"],
      "additionalProperties": false,
      "properties": {
        "title": { "type": "string", "minLength": 1, "maxLength": 60 },
        "steps": { "type": "array", "minItems": 2, "maxItems": 6, "items": { "$ref": "#/$defs/step" } }
      }
    },
    "story": {
      "type": "object",
      "required": ["id", "label", "steps"],
      "additionalProperties": false,
      "properties": {
        "id": { "$ref": "#/$defs/id" },
        "label": { "type": "string", "minLength": 1, "maxLength": 18 },
        "title": { "type": "string", "minLength": 1, "maxLength": 60 },
        "tone": { "enum": ["ok", "fail", "pending"] },
        "steps": { "type": "array", "minItems": 2, "maxItems": 6, "items": { "$ref": "#/$defs/step" } }
      }
    },
    "note": {
      "type": "object",
      "required": ["on", "text"],
      "additionalProperties": false,
      "properties": {
        "on": { "$ref": "#/$defs/id" },
        "text": { "type": "string", "minLength": 1, "maxLength": 56 }
      }
    },
    "badge": {
      "type": "object",
      "required": ["tone", "text"],
      "additionalProperties": false,
      "properties": {
        "tone": { "enum": ["ok", "fail", "warn", "info", "ask"] },
        "text": { "type": "string", "minLength": 1, "maxLength": 8 }
      }
    }
  }
}
